{
  "schema_version": "agent-dispatch.dispatch-intent/v1",
  "dispatch_id": "019c2234-5678-7abc-9def-0123456789ab",
  "decision_id": "019c2234-5678-7abc-9def-012345678901",
  "route": {
    "id": "wiki-maintenance",
    "revision": "sha256:cccccccccccccccccccccccccccccccccccccccccccccccccccccccccccccccc"
  },
  "target_id": "hermes-kanban-main",
  "resource_id": "vault-main",
  "generation": 1,
  "idempotency_key": "agent-dispatch:v1:sha256:eeeeeeeeeeeeeeeeeeeeeeeeeeeeeeeeeeeeeeeeeeeeeeeeeeeeeeeeeeeeeeee",
  "content_fingerprint": "sha256:dddddddddddddddddddddddddddddddddddddddddddddddddddddddddddddddd",
  "state": "ready",
  "request": {
    "contract_version": "agent-dispatch.hermes-task/v1",
    "dispatch_id": "019c2234-5678-7abc-9def-0123456789ab",
    "idempotency_key": "agent-dispatch:v1:sha256:eeeeeeeeeeeeeeeeeeeeeeeeeeeeeeeeeeeeeeeeeeeeeeeeeeeeeeeeeeeeeeee",
    "route": {
      "id": "wiki-maintenance",
      "revision": "sha256:cccccccccccccccccccccccccccccccccccccccccccccccccccccccccccccccc"
    },
    "resource": {
      "id": "vault-main",
      "workspace": "dir:/Users/example/Documents/Obsidian/MainVault"
    },
    "assignment": {
      "profile": "wiki-maintainer",
      "skills": ["llm-wiki"],
      "mutex_key": "wiki-publish"
    },
    "execution_hints": {
      "max_runtime_seconds": 1800,
      "max_attempts": 2
    },
    "activation": {
      "mode": "latest_state",
      "generation": 1,
      "content_fingerprint": "sha256:dddddddddddddddddddddddddddddddddddddddddddddddddddddddddddddddd",
      "manifest": [
        {
          "path": "Inbox/new-note.md",
          "operation": "create",
          "after_digest": "sha256:bbbbbbbbbbbbbbbbbbbbbbbbbbbbbbbbbbbbbbbbbbbbbbbbbbbbbbbbbbbbbbbb"
        }
      ],
      "flags": []
    },
    "acceptance_criteria": [
      "Evaluate the current vault state using the configured LLM Wiki skill.",
      "Re-evaluate indexing, referencing, and grouping affected by the latest state.",
      "Respect Hermes permissions, approvals, and protected-path policy.",
      "Do not assume that a manifest path still exists at execution time.",
      "Report a bounded Agent Dispatch work receipt when the companion CLI is available."
    ]
  },
  "created_at": "2026-08-19T09:30:12.482Z"
}
